our_id,our_name,tier,score,ascend_identifier,ascend_title
4413,Homesite Insurance Co of Pennsylvania,weak,0.591,pennsylvania_insurance_company_boston_6411cb,Pennsylvania Insurance Company
4414,Homesite Insurance Co of the Midwest,weak,0.567,homesite_insurance_company_alpharetta_109158,Homesite Insurance Company
4415,Homesite Lloyds of Texas,none,0.49,,
4134,Honeycomb Programs Inc.,none,0.444,,
4137,Houston International Insurance Group,weak,0.606,american_international_company_parsippany_63b847,American International Company
4125,Houston Specialty Insurance,exact,1.0,houston_casualty_company_los_angelese_da0a75,Houston Casualty Company
4087,INTEGON NATIONAL INSURANCE COMPANY,exact,1.0,integon_national_insurance_co_uniondale_b749bb,INTEGON NATIONAL INSURANCE CO
4747,Imperial Fire & Casualty,exact,1.0,imperial_fire_casualty_insurance_opelousas_95025c,Imperial Fire & Casualty Insurance
4641,Independent Mutual Fire insurance Company,weak,0.626,independent_specialty_insurance_company_bedford_d29505,Independent Specialty Insurance Company
4911,Independent Specialty Insurance Co.,exact,1.0,independent_specialty_insurance_company_bedford_d29505,Independent Specialty Insurance Company
4330,Indian Harbor Insurance Company,exact,1.0,indian_harbor_stamford_8fb235,Indian Harbor
4196,Indiana,weak,0.567,safeco_insurance_company_of_indiana_indianapolis_9b1e12,Safeco Insurance Company of Indiana
4166,Infinity,exact,1.0,infinity_insurance_birmingham_aa9750,Infinity Insurance
4629,Insurance Company of Illinois,exact,1.0,illinois_casualty_company_rock_island_e0cbdf,Illinois Casualty Company
4172,Insurance Specialty Group LLC,none,0,,
4312,Integon Casualty Insurance Co.,exact,1.0,integon_national_insurance_co_uniondale_b749bb,INTEGON NATIONAL INSURANCE CO
4313,Integon General Insurance Corp.,weak,0.555,general_insurance_company_of_america_seattle_030f84,General Insurance Company of America
4314,Integon Indemnity Corp.,exact,1.0,integon_national_insurance_co_uniondale_b749bb,INTEGON NATIONAL INSURANCE CO
4315,Integon National,exact,1.0,integon_national_insurance_co_uniondale_b749bb,INTEGON NATIONAL INSURANCE CO
3865,Integon National Insurance Company,exact,1.0,integon_national_insurance_co_uniondale_b749bb,INTEGON NATIONAL INSURANCE CO
4316,Integon Preferred Insurance Co.,weak,0.533,integon_national_insurance_co_uniondale_b749bb,INTEGON NATIONAL INSURANCE CO
4317,Integon Specialty Insurance Co.,exact,1.0,integon_national_insurance_co_uniondale_b749bb,INTEGON NATIONAL INSURANCE CO
4642,Interboro Mutual Indemnity Insurance Company,none,0.25,,
4173,J.H.Ferguson & Associates LLC,exact,1.0,jh_ferguson_associates_llc_chicago_ed2cce,J.H. Ferguson & Associates LLC
4949,J.H.Ferguson & Associates LLC,exact,1.0,jh_ferguson_associates_llc_chicago_ed2cce,J.H. Ferguson & Associates LLC
3866,James River Insurance Co.,exact,1.0,james_river_insurance_company_richmond_d85362,James River Insurance Company
4177,Jencap Group LLC,none,0.267,,
3758,Johnson & Johnson,none,0.243,,
4178,Johnson & Johnson Inc,none,0.243,,
4181,K & K Insurance Group,exact,1.0,kk_insurance_group_inc_chicago_2cdf8c,"K&K INSURANCE GROUP, INC."
4182,Kemper,none,0.335,,
3867,Kinsale Insurance Company,exact,1.0,kinsale_insurance_company_richmond_115276,Kinsale Insurance Company
4748,LLoyds,exact,1.0,american_national_lloyds_insurance_company_league_city_9fa91f,American National Lloyds Insurance Company
4185,Lancer Insurance,exact,1.0,lancer_insurance_jacksonville_6dc1f6,Lancer Insurance
3868,Landmark American Insurance Co.,exact,1.0,landmark_american_insurance_company_new_york_d06562,Landmark American Insurance Company
4749,Lexington Insurance Company,exact,1.0,lexington_insurance_company_boston_54e3e6,Lexington Insurance Company
3999,Liberty Mutual,exact,1.0,american_liberty_insurance_company_minneapolis_f2c1fd,American Liberty Insurance Company
4197,Liberty Mutual Fire Insurance Co.,exact,1.0,liberty_mutual_fire_insurance_co_salt_lake_city_5195d3,Liberty Mutual Fire Insurance Co
4186,Liberty Mutual Insurance,exact,1.0,american_liberty_insurance_company_minneapolis_f2c1fd,American Liberty Insurance Company
3629,Lincoln Benefit Life-Resolution,none,0.316,,
4619,Lloyd's of London,weak,0.667,lloyds_america_new_york_c52799,Lloyd's America
4077,MARKEL AMERICAN INSURANCE COMPANY,exact,1.0,markel_american_insurance_company_waukesha_f32410,Markel American Insurance Company
4078,MARKEL INSURANCE,exact,1.0,markel_american_insurance_company_waukesha_f32410,Markel American Insurance Company
4263,MERCURY,exact,1.0,american_mercury_insurance_co_oklahoma_city_537da0,American Mercury Insurance Co
4264,MERCURY CASUALTY COMPANY,exact,1.0,american_mercury_insurance_co_oklahoma_city_537da0,American Mercury Insurance Co
4265,MERCURY COUNTY MUTUAL INSURANCE COMPANY,exact,1.0,mercury_county_mutual_insurance_company_oklahoma_city_d6cc79,Mercury County Mutual Insurance Company
4266,MERCURY INDEMNITY COMPANY,exact,1.0,american_mercury_insurance_co_oklahoma_city_537da0,American Mercury Insurance Co
4267,MERCURY INDEMNITY OF AMERICA,exact,1.0,american_mercury_insurance_co_oklahoma_city_537da0,American Mercury Insurance Co
4268,MERCURY INSURANCE COMPANY,exact,1.0,american_mercury_insurance_co_oklahoma_city_537da0,American Mercury Insurance Co
4269,MERCURY INSURANCE COMPANY OF FLORIDA,weak,0.555,american_mercury_insurance_co_oklahoma_city_537da0,American Mercury Insurance Co
4716,MERIDIAN CITIZENS MUT INS CO,none,0.421,,
4318,MIC General Insurance Corp.,weak,0.611,general_insurance_company_of_america_seattle_030f84,General Insurance Company of America
4319,MIC Property & Casualty Insurance,none,0.343,,
3869,MS Transverse Specialty Insurance Co,exact,1.0,ms_transverse_specialty_insurance_company_warren_a66837,MS Transverse Specialty Insurance Company
4331,MS Transverse Specialty Insurance Co,exact,1.0,ms_transverse_specialty_insurance_company_warren_a66837,MS Transverse Specialty Insurance Company
4088,MS Transverse Specialty Insurance Co.,exact,1.0,ms_transverse_specialty_insurance_company_warren_a66837,MS Transverse Specialty Insurance Company
4950,Maine Bonding and Casualty Company,none,0.493,,
4211,Maison Insurance,none,0.267,,
4416,Marathon Insurance Company,none,0.286,,
4212,Markel,exact,1.0,markel_american_insurance_company_waukesha_f32410,Markel American Insurance Company
4213,Markel Insurance Company,exact,1.0,markel_american_insurance_company_waukesha_f32410,Markel American Insurance Company
4214,Marketing,none,0.267,,
4951,Maryland Casualty Company,none,0.4,,
4952,Maryland Insurance Company,none,0.4,,
4270,Mercury Company of Illinois,weak,0.567,illinois_casualty_company_rock_island_e0cbdf,Illinois Casualty Company
4271,Mercury Indemnity of Georgia,weak,0.555,american_mercury_insurance_co_oklahoma_city_537da0,American Mercury Insurance Co
4272,Mercury Insurance Company of Georgia,weak,0.555,american_mercury_insurance_co_oklahoma_city_537da0,American Mercury Insurance Co
4259,Mercury Insurance Group,exact,1.0,american_mercury_insurance_co_oklahoma_city_537da0,American Mercury Insurance Co
4273,Mercury National Insurance Company,exact,1.0,american_mercury_insurance_co_oklahoma_city_537da0,American Mercury Insurance Co
4717,Meridian Security Ins Co,weak,0.556,national_security_insurance_company_elba_6d81e3,National Security Insurance Company
4282,Met Life,none,0.267,,
4287,Metropolitan Casualty Insurance Company,none,0.24,,
4288,Metropolitan Direct Property & Casualty Insurance Co,none,0.36,,
4289,Metropolitan General Insurance Company,weak,0.507,general_insurance_company_of_america_seattle_030f84,General Insurance Company of America
4290,Metropolitan Group Property and Casualty Ins Company,none,0.24,,
4291,Metropolitan Lloyds Insurance Company (Texas),none,0.474,,
4292,Metropolitan Property & Casualty Insurance Co,none,0.24,,
4198,Mid America Fire & Casualty,weak,0.567,american_fire_casualty_company_boston_963d82,American Fire & Casualty Company
4293,Mid-Continent Group,exact,1.0,mid_continent_casualty_company_tulsa_2daadf,Mid Continent Casualty Company
4294,Midland National Life Insurance,none,0.308,,
4295,Midwest Insurance Company,exact,1.0,midwest_insurance_company_springfield_38a491,Midwest Insurance Company
4199,Midwestern Indemnity,none,0.329,,
4718,Milbank Ins Co,none,0.25,,
3642,Milwaukee Casualty Insurance Co.,exact,1.0,milwaukee_casualty_insurance_company_dallas_0000bf,Milwaukee Casualty Insurance Company
4296,Modern Insurance Consultants Llc,weak,0.5,american_modern_insurance_group_cincinnati_41cd70,American Modern Insurance Group
4200,Montgomery Mutual,weak,0.586,montgomery_collins_inc_venice_bd96a5,"Montgomery & Collins, Inc"
4320,Motors Insurance Corporation,none,0.308,,
4417,Mountain Laurel Assurance Co.,none,0.493,,
3870,Mt. Hawley Insurance Company,exact,1.0,mt_hawley_insurance_company_alpharetta_6ad167,Mt. Hawley Insurance Company
4730,NA,none,0.32,,
4731,NOVA Casualty Co,exact,1.0,nova_casualty_company_windsor_c01edd,NOVA Casualty Company
4321,National Alliance Insurance Co.,exact,1.0,american_alliance_rosemont_4db7c9,American Alliance
4418,National Continental Ins. Co.,exact,1.0,american_continental_insurance_franklin_59d76e,American Continental Insurance
4016,National Fire & Marine Insurance Co,exact,1.0,national_fire_marine_insurance_company_omaha_119780,National Fire & Marine Insurance Company
3934,National Fire Insurance Co. Of Hartford,exact,1.0,national_fire_insurance_company_of_hartford_chicago_87a4af,National Fire Insurance Company of Hartford
4089,National Flood Insurance Program,exact,1.0,national_flood_insurance_program_shawnee_mission_4d5099,National Flood Insurance Program
4303,National Flood Insurance Program,exact,1.0,national_flood_insurance_program_shawnee_mission_4d5099,National Flood Insurance Program
4307,National General (NGIC),weak,0.595,general_insurance_company_of_america_seattle_030f84,General Insurance Company of America
4322,National General Assurance Company,exact,1.0,general_insurance_company_of_america_seattle_030f84,General Insurance Company of America
4323,National General Insurance Company,exact,1.0,general_insurance_company_of_america_seattle_030f84,General Insurance Company of America
4953,National Standard Insurance Company,exact,1.0,standard_casualty_company_new_braunfels_7f22c8,Standard Casualty Company
4327,National Unity,none,0.291,,
4328,Natural Catastrophe Insurance Program,none,0.35,,
3871,Navigators Insurance Company,exact,1.0,navigators_insurance_pittsburgh_baf9f9,Navigators Insurance
4329,Neptune Flood Incorporated,none,0.434,,
3562,New Hampshire Insurance Company,exact,1.0,new_hampshire_insurance_company_kalispell_8cdad0,New Hampshire Insurance Company
4324,New South Insurance Co.,none,0.418,,
4332,Next Wave Insurance Services,weak,0.546,next_insurance_palo_alto_1c70ab,Next Insurance
4335,None,none,0.267,,
3806,NorGUARD Ins Co,exact,1.0,norguard_insurance_company_wilkes_barre_99053c,NorGUARD Insurance Company
3630,Northbrook Indemnity Company,none,0.267,,
4954,Northern Insurance Co. of New York,weak,0.615,greater_new_york_mutual_insurance_company_new_york_31d097,Greater New York Mutual Insurance Company
4341,OBIE,none,0.343,,
4922,Obsidian Insurance Company,exact,1.0,obsidian_insurance_company_new_york_6186e3,Obsidian Insurance Company
4348,Occidental Fire & Casualty Co,exact,1.0,occidental_fire_casualty_company_raleigh_0ad036,Occidental Fire & Casualty Company
4643,Occidental Fire & Casualty Company,exact,1.0,occidental_fire_casualty_company_raleigh_0ad036,Occidental Fire & Casualty Company
4201,Ohio Casualty Insurance Co.,exact,1.0,ohio_casualty_insurance_company_fairfield_53fe5b,Ohio Casualty Insurance Company
4202,Ohio Security Insurance Co.,exact,1.0,ohio_security_insurance_company_boston_4f4db6,Ohio Security Insurance Company
4353,"Orbital Risk Capital, Inc",weak,0.555,capital_assurance_company_coral_gables_1adb00,Capital Assurance Company
4719,PATRONS MUT INS CO OF CT,none,0.218,,
4720,PETROLIA INSURANCE COMPANY,none,0.267,,
4794,Pacific Insurance Co,exact,1.0,pacific_indemnity_company_milwaukee_1b5491,Pacific Indemnity Company
4923,Palomar Specialty Ins,exact,1.0,palomar_specialty_insurance_company_portland_036af2,Palomar Specialty Insurance Company
4203,Peerless,exact,1.0,peerless_indemnity_insurance_company_warrenville_ecb590,Peerless Indemnity Insurance Company
4204,Peerless Indemnity Insurance Co.,exact,1.0,peerless_indemnity_insurance_company_warrenville_ecb590,Peerless Indemnity Insurance Company
4122,Philadelphia Indemnity Insurance Company,exact,1.0,philadelphia_indemnity_insurance_company_bala_cynwyd_c0a08a,Philadelphia Indemnity Insurance Company
4644,Pillar,none,0.25,,
4721,Plaza Insurance Company,exact,1.0,plaza_insurance_company_kansas_city_3e27d7,Plaza Insurance Company
4419,Preferred Consumers,weak,0.5,preferred_contractors_insurance_company_carlsbad_06e3f1,Preferred Contractors Insurance Company
4403,Progressive,exact,1.0,progressive_carol_stream_365bef,Progressive 
4420,Progressive American Ins. Co.,exact,1.0,progressive_carol_stream_365bef,Progressive 
4421,Progressive American Life,exact,1.0,progressive_carol_stream_365bef,Progressive 
4422,Progressive Bayside Ins. Co.,weak,0.593,progressive_carol_stream_365bef,Progressive 
4423,Progressive Casualty Ins. Co.,exact,1.0,progressive_carol_stream_365bef,Progressive 
4424,Progressive Classic Ins. Co.,weak,0.593,progressive_carol_stream_365bef,Progressive 
4425,Progressive Consumers,weak,0.575,progressive_carol_stream_365bef,Progressive 
4426,Progressive County Mutual,exact,1.0,progressive_county_mutual_insurance_company_austin_70bb6a,Progressive County Mutual Insurance Company
4427,Progressive Direct Ins. Co (was Halcyon),none,0.376,,
4428,Progressive Express,exact,1.0,progressive_express_insurance_company_mayfield_c3c5f0,Progressive Express Insurance Company
4429,Progressive Gulf Ins. Co.,exact,1.0,progressive_gulf_insurance_company_cleveland_7c936a,Progressive Gulf Insurance Company
4430,Progressive Hawaii Ins. Corp.,weak,0.603,progressive_carol_stream_365bef,Progressive 
4431,Progressive Home Ins. Co.,weak,0.626,progressive_carol_stream_365bef,Progressive 
4432,Progressive Max Ins. Co.,weak,0.638,progressive_carol_stream_365bef,Progressive 
4433,Progressive Michigan,exact,1.0,progressive_michigan_insurance_company_cleveland_f9d31e,Progressive Michigan Insurance Company
4434,Progressive Mountain Ins. Co.,exact,1.0,progressive_mountain_insurance_company_cleveland_448b54,Progressive Mountain Insurance Company
4435,Progressive Northeastern,weak,0.551,progressive_carol_stream_365bef,Progressive 
4436,Progressive Northern Ins. Co.,weak,0.584,progressive_carol_stream_365bef,Progressive 
4437,Progressive Northwestern Ins. Co.,weak,0.551,progressive_carol_stream_365bef,Progressive 
4438,Progressive Paloverde Ins. Co. of Arizona,none,0.42,,
4439,Progressive Preferred Ins. Co.,exact,1.0,progressive_preferred_insurance_company_mayfield_village_e262c4,Progressive Preferred Insurance Company
4440,Progressive Premier Ins. Co. of Illinois,none,0.428,,
4441,Progressive Security,weak,0.584,progressive_carol_stream_365bef,Progressive 
4442,Progressive Southeastern,weak,0.551,progressive_carol_stream_365bef,Progressive 
4443,Progressive Specialty Ins. Co.,exact,1.0,progressive_carol_stream_365bef,Progressive 
4444,Progressive Universal Ins. Co. of Illinois,none,0.422,,
4445,Progressive Value,weak,0.614,progressive_carol_stream_365bef,Progressive 
4446,Progressive West Insurance,weak,0.626,progressive_carol_stream_365bef,Progressive 
4450,Pronto,none,0.25,,
3631,Property Joint Underwriting Association,weak,0.623,alabama_insurance_underwriting_association_foley_903cc7,Alabama Insurance Underwriting Association
4453,Prospect,none,0.267,,
4454,Protecor Financial,none,0.491,,
4458,QBE Flood Insurance Servicing,exact,1.0,qbe_flood_insurance_servicing_denver_04e986,QBE Flood Insurance Servicing
3872,QBE Specialty Insurance Company,exact,1.0,qbe_insurance_corporation_new_york_1e3268,QBE Insurance Corporation
4459,RAINBOW MGA INSURANCE AGENCY INC.,none,0.385,,
4079,REDLAND,none,0.267,,
4080,REPUBLIC UNDERWRITTERS INSURANCE COMPANY,weak,0.591,republic_underwriters_insurance_co_dallas_d8d768,Republic Underwriters Insurance Co
4462,RLI SURETY,weak,0.6,american_surety_company_peoria_heights_bca92d,American Surety Company
4465,RSI,none,0.343,,
4447,Ranchers and Farmers,exact,1.0,ranchers_farmers_mutual_insurance_beaumont_83ec61,Ranchers & Farmers Mutual Insurance
4795,Rated by Multiple Co's,none,0.3,,
4081,Republic Fire and Casualty Insurance Company,none,0.493,,
4890,Republic Franklin Insurance Company,exact,1.0,republicfranklin_insurance_company_utica_0c5114,Republic-Franklin Insurance Company
4544,Republic Home Protectors,none,0.417,,
3750,Republic Underwriters Insurance Company,exact,1.0,republic_underwriters_insurance_co_dallas_d8d768,Republic Underwriters Insurance Co
4737,RetailFirst Insurance Company,none,0.255,,
4738,Retailers Casualty Insurance Company,none,0.267,,
4602,RiskTheory,none,0.255,,
3643,Rochdale Insurance Co.,none,0.25,,
3873,"Rockingham Specialty, Inc",exact,1.0,rockingham_insurance_company_harrisonburg_54e2ed,Rockingham Insurance Company
4899,Ryan Turner Specialty,none,0.24,,
4082,SOUTHERN INSURANCE COMPANY,exact,1.0,american_southern_insurance_company_atlanta_6f5490,American Southern Insurance Company
4083,SOUTHERN VANGUARD INSURANCE INSURANCE COMPANY,weak,0.556,american_southern_insurance_company_atlanta_6f5490,American Southern Insurance Company
4722,STATE AUTO FLORIDA INS. CO,weak,0.686,state_auto_insurance_company_columbus_cbbd34,State Auto Insurance Company
4723,STATE AUTO INS CO OF WI,strong,0.748,state_auto_insurance_company_columbus_cbbd34,State Auto Insurance Company
4616,SW/Risk,none,0.2,,
4617,SWYFFT LLC,exact,1.0,swyfft_morristown_846f06,Swyfft
4645,Safechoice Insurance Co.,none,0.3,,
4621,Safeco,exact,1.0,safeco_insurance_chicago_851780,Safeco Insurance
4630,Safeco Insurance Co. of Illinois,weak,0.578,illinois_casualty_company_rock_island_e0cbdf,Illinois Casualty Company
4631,Safeco Insurance Co. of Indiana,exact,1.0,safeco_insurance_company_of_indiana_indianapolis_9b1e12,Safeco Insurance Company of Indiana
4632,Safeco Insurance Co. of Oregon,exact,1.0,safeco_insurance_company_of_oregon_portland_08d4c1,Safeco Insurance Company  of Oregon
4633,Safeco Insurance Company of America,exact,1.0,safeco_insurance_chicago_851780,Safeco Insurance
4634,Safeco Lloyds Insurance Co,weak,0.553,american_national_lloyds_insurance_company_league_city_9fa91f,American National Lloyds Insurance Company
4635,Safeco Surplus Lines Insurance Co.,weak,0.628,starr_surplus_lines_insurance_company_new_york_faf33b,Starr Surplus Lines Insurance Company
4646,Safeport Insurance Company,none,0.286,,
4349,SageSure Insurance Managers LLC,none,0.474,,
4637,Sagesure,none,0.282,,
3644,Security National Insurance Company,exact,1.0,national_security_insurance_company_elba_6d81e3,National Security Insurance Company
3874,Seneca Insurance Company Inc,exact,1.0,seneca_specialty_insurance_company_new_york_8ada3b,Seneca Specialty Insurance Company
4796,Sentinel Insurance,weak,0.62,sentinel_insurance_company_ltd_hartford_b6d746,"Sentinel Insurance Company, Ltd"
3645,Sequoia Indemnity Co.,exact,1.0,sequoia_insurance_company_las_vegas_853e80,Sequoia Insurance Company
3646,Sequoia Insurance Co.,exact,1.0,sequoia_insurance_company_las_vegas_853e80,Sequoia Insurance Company
4647,Service Insurance Company,exact,1.0,service_american_indemnity_company_austin_9f2095,Service American Indemnity Company
3695,"Silver Oak Casualty, Incorporated",weak,0.642,silver_oak_casualty_slidell_dec8c3,Silver Oak Casualty
4797,Southern County Mutual,exact,1.0,southern_county_mutual_dallas_de9c4e,Southern County Mutual
3751,Southern Insurance Company,exact,1.0,american_southern_insurance_company_atlanta_6f5490,American Southern Insurance Company
4448,Specialty Risk Ins. Co.,none,0,,
3752,Spinnaker Insurance,exact,1.0,spinnaker_insurance_company_chester_8fd2b8,Spinnaker Insurance Company
3995,Spinnaker Insurance Company,exact,1.0,spinnaker_insurance_company_chester_8fd2b8,Spinnaker Insurance Company
4816,St. Paul Fire and Marine Ins. Co.,exact,1.0,st_paul_fire_marine_insurance_company_hartford_06b437,St Paul Fire & Marine Insurance Company
4817,Standard Fire Ins Co.,exact,1.0,standard_fire_insurance_company_hartford_15e3e3,Standard Fire Insurance Company
3875,Starr Indemnity & Liability Company,exact,1.0,starr_indemnity_liability_company_new_york_0f1ca7,Starr Indemnity & Liability Company
3876,Starr Surplus Lines,exact,1.0,starr_surplus_lines_insurance_company_new_york_faf33b,Starr Surplus Lines Insurance Company
4724,State Auto Ins Co of Ohio,strong,0.72,state_auto_insurance_company_columbus_cbbd34,State Auto Insurance Company
4708,State Auto Insurance Companies,weak,0.667,state_auto_insurance_company_columbus_cbbd34,State Auto Insurance Company
4725,State Auto P & C Ins Co,weak,0.633,state_auto_insurance_company_columbus_cbbd34,State Auto Insurance Company
4726,State Automobile Mutual Ins Co,weak,0.608,american_automobile_insurance_company_chicago_f35376,American Automobile Insurance Company
4274,State and County Mutual Fire Insurance Co. (S),weak,0.576,state_national_fire_insurance_shreveport_c6aee6,State National Fire Insurance
4727,Steadfast  Insurance Company,exact,1.0,steadfast_insurance_company_schaumburg_ca3da3,Steadfast Insurance Company
4955,Steadfast Insurance Company,exact,1.0,steadfast_insurance_company_schaumburg_ca3da3,Steadfast Insurance Company
4729,StorageFirst,none,0.255,,
4732,Summit Consulting LLC,weak,0.509,american_summit_insurance_company_scottsdale_0fb104,American Summit Insurance Company
4648,SureChoice Insurance Company,none,0.267,,
4649,SureChoice Underwriters Reciprocal Exchance,none,0.355,,
4739,Suretec Insurance Company,exact,1.0,suretec_insurance_company_houston_b963c0,SureTec Insurance Company
4924,Sutton National Insurance Co.,exact,1.0,sutton_national_insurance_company_delray_beach_16f3ad,Sutton National Insurance Company
4818,TRAVCAL Indemnity Company (Auto),none,0.467,,
4819,TRAVCO Insurance Co.,none,0.267,,
4744,TWFG (The Woodlands Financial Group),none,0.39,,
4750,TWICO,none,0.267,,
4759,Target Insurance Services,none,0.308,,
3647,Technology Insurance Company,exact,1.0,technology_insurance_company_seven_hills_026c18,Technology Insurance Company
4775,Texas Fair Plan Association,weak,0.672,california_fair_plan_association_los_angeles_88265c,California Fair Plan Association
4778,Texas Windstorm Insurance Association,exact,1.0,texas_windstorm_insurance_association_austin_09f07b,Texas Windstorm Insurance Association
3935,The Continental Insurance Co.,exact,1.0,american_continental_insurance_franklin_59d76e,American Continental Insurance
3936,The Continental Insurance Co. of New Jersey,weak,0.574,drive_new_jersey_insurance_company_cleveland_a3f485,Drive New Jersey Insurance Company
4956,The Fidelity and Deposit Company of Maryland,exact,1.0,fidelity_deposit_company_of_maryland_schaumburg_ba4226,Fidelity & Deposit Company of Maryland
4820,The First Floridian,weak,0.5,america_first_insurance_richardson_3f2659,America First Insurance
4779,The Hartford,exact,1.0,hartford_casualty_insurance_company_hartford_19612b,Hartford Casualty Insurance Company
4821,The Phoenix Ins. Co.,exact,1.0,phoenix_insurance_company_chicago_0f484b,Phoenix Insurance Company
4822,The Travelers Indemnity Co.,exact,1.0,the_travelers_minneapolis_551249,The Travelers
4802,The Zenith,exact,1.0,zenith_insurance_company_chicago_7b9971,Zenith Insurance Company
4205,TheNetherlands,none,0.232,,
4805,Three By Berkshire Hathaway,weak,0.62,berkshire_hathaway_specialty_boston_8b7bce,Berkshire Hathaway Specialty
3877,Tokio Marine Specialty Ins Co,exact,1.0,tokio_marine_new_york_75a5a4,Tokio Marine
4620,Topa Insurance Company,exact,1.0,topa_insurance_company_calabasas_106266,Topa Insurance Company
3753,Tower Hill Signature Ins Co,weak,0.667,tower_hill_insurance_gainesville_12a8a6,Tower Hill Insurance
4806,Trans Life Insurance Company,none,0.267,,
3937,Transportation Insurance Coompany,weak,0.603,transportation_insurance_company_chicago_c32828,Transportation Insurance Company
4925,Trasverse Specialty Ins Co.,none,0.379,,
4823,Travelers Casualty & Surety,exact,1.0,travelers_casualty_and_surety_company_hartford_fd1c22,Travelers Casualty and Surety Company
4824,Travelers Casualty & Surety Co of,exact,1.0,travelers_casualty_and_surety_company_hartford_fd1c22,Travelers Casualty and Surety Company
4825,Travelers Casualty & Surety of Illinois,weak,0.712,travelers_casualty_and_surety_company_hartford_fd1c22,Travelers Casualty and Surety Company
4826,Travelers Casualty Insurance Company of America,exact,1.0,the_travelers_minneapolis_551249,The Travelers
4827,Travelers Casualty of Connecticut,weak,0.54,the_travelers_minneapolis_551249,The Travelers
4828,Travelers Commercial Ins.,weak,0.548,the_travelers_minneapolis_551249,The Travelers
4829,Travelers Home and Marine Co.,none,0.44,,
4830,Travelers Indemnity Co. of America,exact,1.0,the_travelers_minneapolis_551249,The Travelers
4831,Travelers Indemnity Co. of Connecticut,weak,0.54,the_travelers_minneapolis_551249,The Travelers
4832,Travelers Indemnity Co. of Illinois,weak,0.567,the_travelers_minneapolis_551249,The Travelers
4833,Travelers Indemnity Co. of Missouri,weak,0.567,the_travelers_minneapolis_551249,The Travelers
4808,Travelers Insurance Co.,exact,1.0,the_travelers_minneapolis_551249,The Travelers
4834,Travelers Lloyds of Texas Ins. Co.,strong,0.737,the_travelers_lloyds_insurance_company_hartford_1ab7b2,The Travelers Lloyds Insurance Company
4835,Travelers Personal security Ins. Co.,strong,0.72,travelers_personal_insurance_dallas_c716bc,Travelers Personal Insurance
