our_id,our_name,tier,score,ascend_identifier,ascend_title
4836,Travelers Property Casualty Co. of Ill.,weak,0.627,the_travelers_minneapolis_551249,The Travelers
4837,Travelers Property Casualty Ins. Co.,exact,1.0,the_travelers_minneapolis_551249,The Travelers
3648,Trinity Lloyds Insurance Co.,weak,0.54,american_national_lloyds_insurance_company_league_city_9fa91f,American National Lloyds Insurance Company
4926,Trisura Insurance Co.,exact,1.0,trisura_specialty_insurance_company_oklahoma_city_d548a8,Trisura Specialty Insurance Company
4136,Trisura Insurance Company,exact,1.0,trisura_specialty_insurance_company_oklahoma_city_d548a8,Trisura Specialty Insurance Company
4650,Trium,none,0.3,,
4798,Trumbull Insurance,exact,1.0,trumbull_insurance_company_hartford_f8f515,Trumbull Insurance Company
4799,Twin City Fire,exact,1.0,twin_city_fire_insurance_company_owings_mills_4624f7,Twin City Fire Insurance Company
4864,UNITED PROPERTY CASUALTY INS CO,exact,1.0,united_national_insurance_company_bala_cynwyd_222226,United National Insurance Company
4957,US Assure Insurance Services of Florida,none,0.392,,
4888,UTICA NATIONAL,exact,1.0,utica_national_new_hartford_2f2046,Utica National
4457,"Underwriters at LLoyds, London",weak,0.693,underwriters_at_lloyds_london_bfe443,Underwriters at Lloyd's London
3878,Underwriters at Llyods of London,weak,0.68,underwriters_at_lloyds_london_bfe443,Underwriters at Lloyd's London
4449,United Financial Casualty Co.,exact,1.0,united_financial_casualty_company_cleveland_338f90,United Financial Casualty Company
4896,United Health,weak,0.553,united_national_insurance_company_bala_cynwyd_222226,United National Insurance Company
4958,United National Insurance Company,exact,1.0,united_national_insurance_company_bala_cynwyd_222226,United National Insurance Company
4866,United Property and Casualty Insurance,exact,1.0,united_national_insurance_company_bala_cynwyd_222226,United National Insurance Company
3879,United Specialty Insurance Company,exact,1.0,united_national_insurance_company_bala_cynwyd_222226,United National Insurance Company
4900,United States Liability,exact,1.0,united_states_liability_insurance_wayne_2e156b,United States Liability Insurance
4897,United States Liability Insurance (USLI),strong,0.811,united_states_liability_insurance_wayne_2e156b,United States Liability Insurance
4906,Universal Insurance Company of North America,weak,0.6,universal_casualty_risk_retention_group_inc_oklahoma_city_d028e3,"Universal Casualty Risk Retention Group, Inc."
4905,Universal N.A. Insurance Co,weak,0.527,universal_casualty_risk_retention_group_inc_oklahoma_city_d028e3,"Universal Casualty Risk Retention Group, Inc."
4907,Universal N.A. Insurance Co.,weak,0.527,universal_casualty_risk_retention_group_inc_oklahoma_city_d028e3,"Universal Casualty Risk Retention Group, Inc."
4908,Universal North America Insurance Company,weak,0.6,universal_casualty_risk_retention_group_inc_oklahoma_city_d028e3,"Universal Casualty Risk Retention Group, Inc."
4891,Utica LLoyds of Texas,none,0.485,,
4892,Utica Mutual Insurance Company,exact,1.0,utica_national_new_hartford_2f2046,Utica National
4893,Utica National Assurance Company,exact,1.0,utica_national_new_hartford_2f2046,Utica National
4894,Utica National Insurance Company of Texas,weak,0.55,texas_insurance_company_omaha_5ffec2,Texas Insurance Company
4895,Utica Specialty Risk Insurance Company,exact,1.0,utica_national_new_hartford_2f2046,Utica National
4084,VIRGINIA SURETY,exact,1.0,virginia_surety_company_chicago_8aa3c7,Virginia Surety Company
3938,Valley Forge Insurance Co.,exact,1.0,valley_forge_insurance_company_chicago_76393a,Valley Forge Insurance Company
3880,Velocity Risk Insurance,exact,1.0,velocity_specialty_insurance_company_nashville_b65143,Velocity Specialty Insurance Company
4910,"Velocity Risk Underwriters, LLC",exact,1.0,velocity_risk_underwriters_nashville_a1cd79,Velocity Risk Underwriters
3881,Velocity Specialty Insurance Company,exact,1.0,velocity_specialty_insurance_company_nashville_b65143,Velocity Specialty Insurance Company
3882,Victor Insurance Exchange,weak,0.514,fire_insurance_exchange_kalispell_4ac3a8,Fire Insurance Exchange
4912,Victor Insurance Managers Inc.,none,0.442,,
4918,Wealth Design Group LLC,none,0.218,,
4919,Wellington Risk,none,0.295,,
3649,Wesco Insurance Co,exact,1.0,wesco_insurance_company_new_york_ecfc88,Wesco Insurance Company
4206,West American Insurance Co.,exact,1.0,insurance_company_of_the_west_san_diego_4c2264,Insurance Company of the West
3807,WestGUARD Ins Co,exact,1.0,westguard_philadelphia_17ea07,WestGUARD
3883,Westchester Surplus Line Insurance Co,weak,0.692,westchester_surplus_lines_insurance_philadelphia_6c7d43,Westchester Surplus Lines Insurance
3978,Westchester Surplus Lines Insurance Co,exact,1.0,westchester_surplus_lines_insurance_philadelphia_6c7d43,Westchester Surplus Lines Insurance
4651,Wilshire Ins Co,none,0.267,,
4927,Worth Casualty Company,exact,1.0,worth_casualty_company_fort_worth_b7e1b4,Worth Casualty Company
4938,Wright Flood (Fidelity National),weak,0.691,wright_national_flood_st_petersburg_71e3ea,Wright National Flood
4939,Wright National Flood Insurance,exact,1.0,wright_national_flood_st_petersburg_71e3ea,Wright National Flood
4943,Zurich North America,exact,1.0,zurich_north_america_insurance_company_schaumburg_24aaf9,Zurich North America Insurance Company
4959,Zurich-American Insurance Company,exact,1.0,american_zurich_insurance_company_schaumburg_fbd926,American Zurich Insurance Company
4960,Zurich-American Insurance Company of Illinois,weak,0.578,illinois_casualty_company_rock_island_e0cbdf,Illinois Casualty Company
